{
  "version": 1,
  "presentationProject": "managed/Consumer.Presentation.csproj",
  "viewModelIr": "view-model.ir.json",
  "generatedAdaptersDirectory": "managed/Generated",
  "generatedRegistryFile": "generated/RustViewRegistry.g.cs",
  "generatedRustFile": "generated/generated_view_models.rs",
  "generatedContractFile": "generated/view-model.contract.md",
  "cargoManifest": "Cargo.toml",
  "packageName": "pdf-viewer",
  "binary": "pdf-viewer",
  "rid": "win-x64",
  "configuration": "Release",
  "outputDirectory": "artifacts/win-x64"
}
